{"artifact_publication":{"artifact-binding-once.guard":null,"artifact-binding-receipt.json":null},"completed_SOURCE":{"metadata-source-parent.json":null,"source-caller-os.json":null,"source-caller.stderr.bin":null,"source-caller.stdout.bin":null,"source-launch-once.json":null,"source-launch-receipt.json":null},"evidence_root":"/Users/m1-dev/.local/state/openergy-verification/m1-ordinary-reviewed-flow-20261025-4b20357c1503","execution":false,"parent":{"actual_all53_source_statuses_and50_comparisons_and212_raws_inspected":null,"actual_prepare_exit_EOF_and_full_receipt_retention_owned":null,"actual_rendered_payload_le_1MiB_bound":null,"actual_source_boundary_and_all_seven_originals_inspected":null,"actual_source_collector0_ssh0_eof_D4_inspected":null,"all_final_source_and_review_payloads_bound":null,"all_supporting_raw_refs_and_build_ABI_plist_no_transfer_inspected":null,"artifact_data_independent_clear_bound":null,"console_single_writer_live_reader_bound":null,"exact29token_route_and_SYSTEM_stdin_entry_authenticated":null,"exact_single_CONFIG_token_restore_prefix_suffix_AST_hash_verified":null,"exclusive_root_no_other_mutators_through_exit":null,"full_artifact_schema_and_receipt_contract_satisfied":null,"original_local135_work130_and_remote_enclosure_owned":null,"publisher_actual_collector0_ssh0_eof_D4_inspected":null,"publisher_full_receipt_all8_actual_bytes_modes_inspected":null,"publisher_independent_clear_bound":null},"reviews":{"artifact_data":{"candidate_commit":null,"review_commit":null,"review_sha256":null,"source_sha256":null,"verdict":null},"capsule":{"candidate_commit":null,"review_commit":null,"review_sha256":null,"source_sha256":null,"verdict":null},"publisher":{"candidate_commit":null,"review_commit":null,"review_sha256":null,"source_sha256":null,"verdict":null}},"schema":"openergy.prepare-parent-config.v1","template_sha256":null}
